{
  "schema_version": "5.1",
  "kind": "script",
  "lineage": {
    "story": "36bc283852099c789bbb843de84eaa0cc3e3c8898397cf58e9c95a04e9d01fdb",
    "cast": "dc68df78fe3a65fed6cd5bce5139343ffb2af0e441a588fee4db4988bda50a87",
    "assets": "7f1481dfca8853d70989aa67da55f0036cfc8647b1d80cff43db6b74fccee8d4"
  },
  "beats": [
    {
      "beat_id": "B001",
      "scene_id": "SCN_LIVING_NIGHT",
      "speaker": "CHAR_A",
      "dialogue": "你笑了？",
      "spoken_language": "Chinese",
      "start_s": 0.2,
      "end_s": 2.2,
      "emotion": {
        "cn": "克制、自然",
        "en": "restrained and natural"
      },
      "action": {
        "cn": "保持原位，说完短句",
        "en": "Remain in the established position and deliver the short line"
      },
      "source_beat_ids": [
        "SRC_B001"
      ]
    },
    {
      "beat_id": "B002",
      "scene_id": "SCN_LIVING_NIGHT",
      "speaker": "CHAR_B",
      "dialogue": "没有。",
      "spoken_language": "Chinese",
      "start_s": 2.7,
      "end_s": 4.5,
      "emotion": {
        "cn": "克制、自然",
        "en": "restrained and natural"
      },
      "action": {
        "cn": "保持原位，说完短句",
        "en": "Remain in the established position and deliver the short line"
      },
      "source_beat_ids": [
        "SRC_B002"
      ]
    },
    {
      "beat_id": "B003",
      "scene_id": "SCN_LIVING_NIGHT",
      "speaker": "CHAR_A",
      "dialogue": "你笑了？",
      "spoken_language": "Chinese",
      "start_s": 0.2,
      "end_s": 2.2,
      "emotion": {
        "cn": "克制、自然",
        "en": "restrained and natural"
      },
      "action": {
        "cn": "保持原位，说完短句",
        "en": "Remain in the established position and deliver the short line"
      },
      "source_beat_ids": [
        "SRC_B003"
      ]
    },
    {
      "beat_id": "B004",
      "scene_id": "SCN_LIVING_NIGHT",
      "speaker": "CHAR_B",
      "dialogue": "没有。",
      "spoken_language": "Chinese",
      "start_s": 2.7,
      "end_s": 4.5,
      "emotion": {
        "cn": "克制、自然",
        "en": "restrained and natural"
      },
      "action": {
        "cn": "保持原位，说完短句",
        "en": "Remain in the established position and deliver the short line"
      },
      "source_beat_ids": [
        "SRC_B004"
      ]
    },
    {
      "beat_id": "B005",
      "scene_id": "SCN_LIVING_NIGHT",
      "speaker": "CHAR_A",
      "dialogue": "你笑了？",
      "spoken_language": "Chinese",
      "start_s": 0.2,
      "end_s": 2.2,
      "emotion": {
        "cn": "克制、自然",
        "en": "restrained and natural"
      },
      "action": {
        "cn": "保持原位，说完短句",
        "en": "Remain in the established position and deliver the short line"
      },
      "source_beat_ids": [
        "SRC_B005"
      ]
    },
    {
      "beat_id": "B006",
      "scene_id": "SCN_LIVING_NIGHT",
      "speaker": "CHAR_B",
      "dialogue": "没有。",
      "spoken_language": "Chinese",
      "start_s": 2.7,
      "end_s": 4.5,
      "emotion": {
        "cn": "克制、自然",
        "en": "restrained and natural"
      },
      "action": {
        "cn": "保持原位，说完短句",
        "en": "Remain in the established position and deliver the short line"
      },
      "source_beat_ids": [
        "SRC_B006"
      ]
    }
  ]
}
