{
  "schema_version": "5.1",
  "kind": "script",
  "lineage": {
    "story": "087cbfcfcb4bc7af9057333973f6c7498dcae329b91375db91c2c1b56aaac113",
    "cast": "c6040beb98f21c09f1fae765c5320a1933e84ab769327c4ae56ffd1de9d6bb99",
    "assets": "d77dcbbbe1c3be9e55642bb76d1e9d1fe3076fb3344facbefcb51942daa1742b"
  },
  "beats": [
    {
      "beat_id": "B001",
      "scene_id": "SCN_LIVING_NIGHT",
      "speaker": "CHAR_A",
      "dialogue": "你笑了？",
      "spoken_language": "Chinese",
      "start_s": 0.2,
      "end_s": 2.2,
      "emotion": {
        "cn": "克制、自然",
        "en": "restrained and natural"
      },
      "action": {
        "cn": "保持原位，说完短句",
        "en": "Remain in the established position and deliver the short line"
      },
      "source_beat_ids": [
        "SRC_B001"
      ]
    },
    {
      "beat_id": "B002",
      "scene_id": "SCN_LIVING_NIGHT",
      "speaker": "CHAR_B",
      "dialogue": "没有。",
      "spoken_language": "Chinese",
      "start_s": 2.7,
      "end_s": 4.5,
      "emotion": {
        "cn": "克制、自然",
        "en": "restrained and natural"
      },
      "action": {
        "cn": "保持原位，说完短句",
        "en": "Remain in the established position and deliver the short line"
      },
      "source_beat_ids": [
        "SRC_B002"
      ]
    },
    {
      "beat_id": "B003",
      "scene_id": "SCN_LIVING_NIGHT",
      "speaker": "CHAR_C",
      "dialogue": "你笑了？",
      "spoken_language": "Chinese",
      "start_s": 0.2,
      "end_s": 2.2,
      "emotion": {
        "cn": "克制、自然",
        "en": "restrained and natural"
      },
      "action": {
        "cn": "保持原位，说完短句",
        "en": "Remain in the established position and deliver the short line"
      },
      "source_beat_ids": [
        "SRC_B003"
      ]
    },
    {
      "beat_id": "B004",
      "scene_id": "SCN_LIVING_NIGHT",
      "speaker": "CHAR_B",
      "dialogue": "没有。",
      "spoken_language": "Chinese",
      "start_s": 2.7,
      "end_s": 4.5,
      "emotion": {
        "cn": "克制、自然",
        "en": "restrained and natural"
      },
      "action": {
        "cn": "保持原位，说完短句",
        "en": "Remain in the established position and deliver the short line"
      },
      "source_beat_ids": [
        "SRC_B004"
      ]
    },
    {
      "beat_id": "B005",
      "scene_id": "SCN_LIVING_NIGHT",
      "speaker": "CHAR_A",
      "dialogue": "你笑了？",
      "spoken_language": "Chinese",
      "start_s": 0.2,
      "end_s": 2.2,
      "emotion": {
        "cn": "克制、自然",
        "en": "restrained and natural"
      },
      "action": {
        "cn": "保持原位，说完短句",
        "en": "Remain in the established position and deliver the short line"
      },
      "source_beat_ids": [
        "SRC_B005"
      ]
    },
    {
      "beat_id": "B006",
      "scene_id": "SCN_LIVING_NIGHT",
      "speaker": "CHAR_B",
      "dialogue": "没有。",
      "spoken_language": "Chinese",
      "start_s": 2.7,
      "end_s": 4.5,
      "emotion": {
        "cn": "克制、自然",
        "en": "restrained and natural"
      },
      "action": {
        "cn": "保持原位，说完短句",
        "en": "Remain in the established position and deliver the short line"
      },
      "source_beat_ids": [
        "SRC_B006"
      ]
    }
  ]
}
